text,author
Уныние и какая-то боязнь изображались на ‘всех лицах.,Unknown
"Андреевич, огорченный неудачею, объяснил офицерам, принадлежавщим к Обществу, цель своей поездки, рассказал им свое свидание с Швейковским, с Арт.",Unknown
"В сих мыслях он подошел к одной из боковых дверей и попробовал отворить оную, но внутренний замок сопротивлялся его силе.",Unknown
"Незадолго до выстрелов он начал что-то говорить:  — Я не виноват, — были последние слова, как ружейный залп вырвал у него жизнь с быстротою молнии.",Unknown
"Сначала он скрывал боль, но вскоре природа восторжествовала над твердостью его души и он упал без памяти на землю в сильных конвульсиях и невольным стоном обнаружил свои страдания.",Unknown
Собрание поручило тотчас члену Общества Саратовского же полка юнкеру Шеколле привести предложение Кузьмина в исполнение.,Unknown
"Может быть, нужно было одного человека, одной минуты, и Бобруйск был бы в руках Общества, но какая-то невидимая сила держала солдат и офицеров, как прикованных к одному месту.",Unknown
"Киреев, Горбачевский, Андреевич, Веденяпин 1-й, Борисов 2-й, Громницкий и прочие тотчас по окончании репетиции пришли к Муравьеву и застали там: Артамона Муравьева, Тизенгаузена, Швейковского, Враницкого, Фролова, Пыхачева, Врангеля, Нащокина, Бестужева-Рюмина и прочих.",Unknown
"Как я, так и вся рота, знаем цель Сергея Ивановича Муравьева; я ручаюсь за солдат.",Unknown
"Потом начал говорить он о силе своего Общества, об управлении оного: Верховною думою; о готовности Москвы и Петербурга начать переворот; об участии в сих намерениях 2-й армии, гвардейского корпуса и многих полков 3-го и 4-го корпусов.",Unknown
Черниговцы восстали: стыдно нам от них отстать!,Unknown
"Те же, которые он, неизвестно почему, оставил, были впоследствии захвачены правительством.",Unknown
Радость их была неимоверная.,Unknown
"Тут начал он спрашивать Мозалевского, к кому он приезжал в Киев и с какими именно поручениями.",Unknown
"Соловьев и его товарищи благодарили добрых киевлян, но не приняли предложенных им денег, хотя нуждались как в деньгах, так и в платье.",Unknown
"Однако, несмотря на сей строгий приказ, Щепилло и Соловьев не только принимали посещения других офицеров, говорили с солдатами, но даже рассказали им подробно о всем случившемся в Трилесах и просили их не оставлять своих товарищей в столь трудных обстоятельствах.",Unknown
— говорили иные.,Unknown
"Сухинов, не теряя духа, бросился на штыки, осыпал сабельными ударами угрожавших ему убийц и выгнал их из дому.",Unknown
"Борисов 1-й, возвращаясь из Старого Константинова, заехал в Барановку к Горбачевскому и Бечаснову и сказал им, что он виделся с Тютчевым, Громницким и Лисовским, которые готовы действовать, но отсоветовали ему ехать к Спиридову, говоря, что они сами сообщат майору свои намерения.",Unknown
"— Я думаю совершенно противное, г. полковник, — сказал он,— в этом случае нужна решительность и сильная воля; если вы не хотите сами говорить с офицерами и солдатами, то соберите полк в штаб-квартиру и остальное нам предоставьте.",Unknown
Да погибнет дворянство вместе с царским саном!..,Unknown
"Узнав, что Соловьев и Щепилло приехали в Васильков и остановились у полкового квартирмейстера, поручика Войниловича, майор Трухин тотчас взял роту внутренней стражи, городничего и дежурного по караулам, поручика Быстрицкого, пошел на квартиру офицера и там арестовал Соловьева и его товарищей, в то время как они отдыхали, ожидая свежих лошадей.",Unknown
И с этим словами они оба вошли прямо в комнату.,Unknown
Многие его поддержали.,Unknown
"Им была прочтена сентенция та же самая, что и Соловьеву.",Unknown
Каждый из офицеров Черниговского полка содержался в особой комнате.,Unknown
"— Мои товарищи — отвечал Сухинов, — не знают ничего и не должны вовсе знать: вы должны таить от них все, что я вам говорю.",Unknown
Известие сие чрезвычайно ободрило славян.,Unknown
В 8 часов утра 29 декабря Кузьмин и Сухинов прискакали первые из Трилесы.,Unknown
"Члены Южного общества действовали, большею частию, в кругу высшего сословия людей; богатство, связи, чины и значительные должности считались как бы необходимым условием для вступления в Общество; они думали произвести переворот одною военною силою, без участия народа, не открывая даже предварительно тайны своих намерений ни офицерам, ни нижним чинам, из коих первых надеялись увлечь энтузиазмом и обещаниями, а последних — или теми же средствами, или — деньгами и угрозами.",Unknown
Оставим догадки и предположения и возвратимся к печальной существенности — к нашему повествованию.,Unknown
"Сверх того находились тут и Полтавского полка поручик Бестужев-Рюмин, отставной полковник Матвей Муравьев-Апостол и приехавший на время сбора полка на площадь свиты е. в. подпоручик Ипполит Муравьев-Апостол.",Unknown
Эти слова были громовым ударом для обоих братьев и Артамона Муравьева.,Unknown
"23 августа, на другой день их приезда в сей город, они были выведены на городскую площадь, на которой собран был Тамбовский пехотный полк, занимавший в сие время прежние квартиры старого Черниговского полка, и батальон, составленный из солдат, выбранных из всех рот каждого полка 9-й дивизии.",Unknown
"Андреевич, раздраженный таким поведением, сказал с негодованием:  — Успокойтесь, г. полковник, я вижу, вы бледны как смерть; успокойтесь, я вас оставлю, — и с этими словами удалился.",Unknown
Ужели одни военные люди примут в этом участие?,Unknown
"Они оскорбляли несчастную жену своего командира, а некоторые даже предлагали убить ее, вместе с малолетними ее детьми.",Unknown
Глухой ропот в рядах сопровождал почти каждое слово священника.,Unknown
"Шутов отвечал, что не может ему повиноваться и нарушить обещания, данного ротному командиру поручику Кузьмину и батальонному командиру С. И. Муравьеву; что ежели его команда оставит, то он один пойдет в Васильков.",Unknown
"Все офицеры Черниговского полка были привезены в Могилев и там преданы военному суду при Главной квартире, исключая капитана Фурмана и С. Муравьева, которые судились в Петербурге.",Unknown
"Сухинов, человек пылкого и решительного характера, раздраженный неудачей восстания и своими несчастиями, поклялся всеми средствами вредить правительству.",Unknown
"Голиков поражал всех диким и независимым своим нравом: какая-то душевная сила возвышала его над всеми другими и приводила в трепет самых закоснелых, отчаянных воров и разбойников.",Unknown
"Сухинов, не по собственному признанию, а по свидетельству других, и главные его сообщники были приговорены к позорному и тяжкому наказанию 400 ударами кнутом.",Unknown
"Тут же к виселице прибили доску с именами Щепиллы, Кузьмина и Ипполита Муравьева.",Unknown
"31 декабря 1825 г. в 2 часа пополудни роты Черниговского полка, под командою С. Муравьева, вступили в Мотовиловку, где уже были собраны 1-я гренадерская рота и часть 1-й мушкетерской и ожидали его прибытия.",Unknown
"Они употребляли все возможные усилия к приготовлению своих подчиненных, старались как бы слиться с ними, породнить их со своими мыслями и желаниями: они даже открыли им все свои намерения, и когда поверяли им свои надежды, в сем случае славяне Черниговского полка и 8-й бригады переступили, может быть, границы благоразумия, но, к их счастию и к чести русских, между нижними чинами не нашлось ни одного изменника.",Unknown
"Кузьмин и Сухинов, пораженные таковыми приветствиями, старались, однако ж, сохранить хладнокровие и не отвечать ни слова на дерзости Гебеля.",Unknown
"Снег был глубок и вязок; Сухинов никак не мог выйти и уже думал, что тут кончилось его предприятие при самом начале.",Unknown
"Упорствуя в прежних своих показаниях, он отвергал все улики ссыльных, оправдывал Соловьева и Мозалевского и совершенно отрицал существование заговора.",Unknown
"Немедленно по возвращении из Лещинского лагеря на зимние квартиры, славяне, горевшие нетерпением достигнуть желаемой цели, начали распространять свои мысли между нижними чинами.",Unknown
"6 декабря 1824 года Борисов 2-й и Горбачевский после долгого совещания признали, что для единства в действиях к скорейшему достижению предназначенной цели необходимо ускорить ход Общества, дать новое образование оному — учредить порядок в делах и подвергнуть членов ответственности за их действия.",Unknown
"— Вее они благородные люди‚— сказал он в заключение, — забывая почести и богатство, поклялись освободить Россию от постыдного рабства и готовы умереть за благо своего отечества.",Unknown
Надежда возбудилась в сердцах славян.,Unknown
"Образ переходил из рук в руки: славяне с жаром целовали его, обнимали друг друга с горящими на глазах слезами, радовались как дети, одним словом, это собрание походило на сборище людей исступленных, которые почитали смерть верховным блатом, искали и требовали оной.",Unknown
"Они поручили Андреевичу успокоить его на счет их, ибо коль скоро они узнают о восстании, то немедленно взбунтуют Черниговский полк и придут на сборное место.",Unknown
В деревне Пологах ночью со 2 на 3 января несколько гусар подъехали к самым часовым.,Unknown
"Но более всего требуйте от них ответов, — повторил он Мозалевскому несколько раз.",Unknown
"В бедствии и в неволе он считал не только правом, но долгом искать собственными силами свободы и счастия; к тому же его душа искала всегда сильных потрясений; посреди опасности только он находился в своей сфере.",Unknown
"Наконец, после долгих рассуждений, которые имели целью с одной стороны — получить решительный ответ на предложение, а с другой — избежать оного и оставить сие дело не конченным, условились назначить общее собрание членов Славянского общества, на котором Муравьев и Бестужев обещали лично возобновить свои предложения.",Unknown
"Отчаяние изображалось на его лице, вид Муравьева привел его в исступление, ругательные слова поллись из дрожащих от ярости уст его.",Unknown
"Потом просил он его достать ему лошадей, чтобы догнать Черниговский полк; еврей старался сыскать, но не мог, хотя Андреевич обещал ему тотчас заплатить вдесятеро.",Unknown
"Здесь Горбачевский рассказал С. Муравьеву предполагаемый славянами план действия на нижних чинов и говорил, что должно принять всем членам одинакой способ действий.",Unknown
"Тот же день неизвестно кто уведомил Сухинова, что он приговорен к 400 ударам кнута и что генерал Лепарский приехал в завод.",Unknown
"Для начала действия им необходимо было узнать, где С. Муравьев и на что он решился?",Unknown
"Когда Троцкого и Трусова представили коменданту сей крепости генералу Безаку, который их лично знал, он им сказал:  — Вы меня простите, я нисколько не могу смягчить вашей участи: вы по такому делу сосланы сюда, что я ничего не в состоянии для вас сделать.",Unknown
"Влияние Васильковской управы возбудило бурные страсти, до того времени дремавшиие в сердцах славян.",Unknown
"Мы не знаем, где и когда он познакомился с одной благородною девицею, но любил ее и был любим взаимно.",Unknown
"Муравьев и Бестужев, прощаясь с Пестовым и Горбачевским, просили пх сообщить о всем происходившем на сем совещании Борисову 2-му и желали, чтоб он непременно, до выхода из лагеря, с ними повидался.",Unknown
"Управляющий, видя Козакова пьяным, отослал его в казарму, сказав, что он потребует его к себе через несколько времени.",Unknown
"В этот же самый день (24 мая) Голиков и Бочаров, со многими из своих соумышленников, пьянствовали в кабаке и когда, прогуляв назначенные для сего деньги, начали расходиться по домам, то пьяный Козаков, проходя мимо управляющего рудниками маркштейгера г. Черниговцова и увидя его близ окна, вздумал сделать донос на своих товарищей.",Unknown
"Через два дня Андреевич оставил 8-ю бригаду и возвратился в Киев, откуда 24 декабря отправился в Васильков к Муравьеву, которого, как мы видели выше, не найдя дома, поехал отыскивать после минутного свидания с офицерами Черниговского полка.",Unknown
"Щепилло, Кузьмин, Соловьев и Быстрицкий, заметя в солдатах внезапную перемену и полагая, что на их нравственное состояние имело влияние бегство многих офицеров, которые ночью уехали в Васильков, тотчас пошли уведомить о сем С. Муравьева и просили его взять против сего меры.",Unknown
— закричал в бешенстве Вузьмин.,Unknown
"22 или 23 июля, на другой день их приезда в помянутый город, новый Черниговский полк был собран на городской площади под командою излечившегося от ран полковника Гебеля.",Unknown
"— Для приобретения свободы,— вскричал он,— не нужно никаких сект, никаких правил, никакого принуждения, — нужен один энтузиазм.",Unknown
— Нам нужны доказательства!,Unknown
Сия мысль укрепляла и увеличивала его озлобление: вредить правительству чем бы то ни было сделалось для него потребностью; освободить себя и всех было его любимою мыслью.,Unknown
Вопросы Борисова 2-го произвели страшное действие на Бестужева-Рюмина; негодование изобразилось во всех чертах его лица.,Unknown
"17 мая они купили дом с огородом и другими хозяйственными заведениями, а 24 числа перешли с нанимаемой ими квартиры в думали вполне заняться хозяйством.",Unknown
Командиры 3-го и 4-го корпусов действовали с необычайной скоростью.,Unknown
"Потом приказал поручику Быстрицкому ехать в деревню, принять роту Соловьева и привести ее в Васильков.",Unknown
"Сухинов был сильно огорчен, когда узнал от лекаря, что действие яда уничтожено.",Unknown
"Он тотчас же догадался, что солдаты, оставив ряды, ворвались во внутренность дома и предаются там бесчинству.",Unknown
"Сего, однако ж, не случилось, но вместо Тихановского в 9 часов вечера на Богуславскую заставу прискакал жандармский поручик Несмеянов.",Unknown
По прошествии сего времени горное начальство получило повеление от коменданта Лепарского прислать государственных преступников Соловьева и Мозалевского в Читинский острог.,Unknown
"Веселость Кузьмина действительно заставила Соловьева думать, что рана не опасна: он замолчал, ожидая приезда на место.",Unknown
"Кузьмин ему отвечал:  — Я ранен, но сделай милость, не сказывай о сем никому.",Unknown
"Упрекать Сухинова в расточительности не позволяла им деликатность, а угрожавшая бедность, и, может быть, ужасное наказание, рождало в них сильное беспокойство.",Unknown
"Борисов 2-й представил собранию отчет, содержащий в себе цель и правила Славянского общества, проект нового образования Славянского союза, мнения и действия членов и присовокупил к сему общий список всех славян, с означением настоящего их местопребывания и рода службы.",Unknown
"— В последний раз говорю вам, что ваше требование не может быть исполнено: мой полк не готов, — возразил полковник и вышел в другую комнату.",Unknown
"5 сентября 1826 года с партиею арестантов они отправились в Москву через города Козелец, Нежин, Глухов, Орел и Калугу.",Unknown
Освободить его!,Unknown
