text,author
"Когда же Голиков и Бочаров, удивленные сим ответом, старались узнать, по какой причине он скрывает свои замыслы от своих товарищей, с которыми живет дружно и разделяет все, что имеет, то Сухинов сказал им:  — Если Соловьев и Мозалевский узнают о нашем предприятии, то они помешают нам.",Unknown
"Они требовали от своего сочлена, нимало не взирая на светские его отношения, старания стремиться к собственному усовершенствованию, презрения к предрассудкам и твердого и обдуманного желания полного во всем преобразования.",Unknown
"Сергей Муравьев с Горбачевским, удалившись в другой конец комнаты, разговаривали о восстании, в особенности о приготовлении солдат.",Unknown
"Не думайте же, г-н подполковник, что я и мой товарищи пришли просить у вас позволения быть патриотами!",Unknown
Кровли домов и заборы — все было унизано зрителями.,Unknown
"В Паволочи командир конной роты артиллерийской и офицеры, принадлежа к Обществу, конечно, не упустили бы случая оправдать при появлении С. Муравьева делом все, что говорилось ими при других членах.",Unknown
"Андреевич, видя, что он отказывается, возразил с жаром:  — По крайней мере, дайте мне, полковник, один эскадрон гусар: я пойду с ним в артиллерийские роты и там начнем действие.",Unknown
"Разными проселочными дорогами, наконец, 29 декабря, под вечер, они достигли деревни Трилесы, отстоящей от Василькова в 45 верстах, и остановились на квартире поручика Кузьмина, квартировавшего в сей деревне с своею ротою.",Unknown
"Вследствие сего намерения он принял в Общество двух ротных командиров: поручика Троцкого и подпоручика Трусова, пылких и решительных молодых людей, сообщил им все известное о делах и намерениях тайного общества, взял обещание действовать по общему плану и поднять знамя свободы при первом знаке к восстанию.",Unknown
"— Мы не знаем, где он и что с ним делается, — отвечали славяне.",Unknown
"Таким образом прекращались все беспорядки, почти неизбежные при движении полка.",Unknown
Приезд Бестужева-Рюмина довершил упоение.,Unknown
Солдаты укоротили дистанцию и начали поодиночке стрелять.,Unknown
"Однако ж после многих сообщений, рассуждений и даже сильных споров положили: собраться на квартире подпоручика Пестова и Борисова 2-го всем членам, находящимся в лагере, пригласить туда Муравьева и Бестужева, вступить с ними в переговоры и потом положить, должно ли Славянское общество оставаться на прежнем основании, или, соединясь с Южным, принять иной вид и характер?",Unknown
"— Я сейчас еду, — сказал он с жаром, — в С.-Петербург к государю, расскажу ему все подробно об Обществе, представлю, с какою целью оно было составлено, что намеревалось сделать и чего желало.",Unknown
"Они приняли все предосторожности для отвращения всякого подозрения; старались даже, чтобы дворовые люди не знали о приходе Сухинова.",Unknown
Москва и Петербург с нетерпением ожидают восстания войск.,Unknown
"Зная несчастные следствия оного, они хотели произвесть новое восстание на юге и тем спасти тайное общество от конечной гибели.",Unknown
Проницательность и опытность старого служивого внушили ему сие здоровое размышление.,Unknown
Сделать народ участником переворота казалось ему весьма опасным.,Unknown
Слова Щепиллы произвели сильное впечатление на присутствующих; они видели обман со стороны Бестужева и многие приняли сторону черниговских офицеров.,Unknown
"По приезде в Могилев Троцкий и Трусов в тот же день были отправлены в Петербург, из коего, по прошествии суток, были снова отосланы в Главную квартиру с повелением кончить дело в 24 часа.",Unknown
Появление Бестужева прекратило сии прения.,Unknown
"— Сидя в холодном погребе, — говорил он, — слыша лошадиный топот и крики гусар, я решился умереть.",Unknown
"— Это все очень хорошо, — сказал он, отдавая назад Муравьеву натянутый лист,— но я уверен, что никто из славян не согласится таким образом действовать; что же касается меня, то я первый отвергаю сей способ и не прикоснусь до сего листа.",Unknown
"Между тем как искали лошадей для Борисова 1-го, брат его написал к Громницкому, Тютчеву и Лисовскому письмо в весьма сильных выражениям, напомнил им обещанные узы, их соединяющие; клятву, данную Южному обществу, общую опасность, законы чести, одним словом — все, что только могло пробудить в них самоотвержение и решить трудный выбор между смертью и позором.",Unknown
Невозможно представить себе всех ужасов сей кровавой сцены.,Unknown
— Где податель?,Unknown
"— Я служу у помещика и потому нахожусь в зависимости, не могу ничего сделать для вас без его согласия, но рад вам пособить всем, чем могу и что принадлежит собственно мне.",Unknown
"По окончании выше описанного совещания Спиридов возвратился в лагерь, посетил Муравьева и между прочими разговорами сказал ему, что успехи Славянского общества невероятны.",Unknown
Справедливое подозрение побудило их к решительному поступку.,Unknown
Добрый крестьянин спрятал его в погребе.,Unknown
Немедленно по восстаний славяне полагают необходимым объявить скорое освобождение крестьян.,Unknown
После непродолжительных прений славяне предоставили право другим изложить мысли о сем предмете и предложить их к следующему собранию на общее утверждение.,Unknown
"Но к соединению двух обществ не столько содействовало сходство их характеров, сколько нетерпение и желание скорейшего достижения цели.",Unknown
"Во все продолжение краткой своей болезни она слышала стон своего друга, видела кровь его и старалась остановить свирепых его мучителей: искусство врачей было бесполезно, — и в тот же самый вечер смерть прекратила ее страдания.",Unknown
"Отправив его, пензенские офицеры снова начали рассуждать о предложении артиллеристов 8-й бригады.",Unknown
Эта мысль чрезвычайно понравилась Бестужеву; он и Муравьев просили славян собраться на другой же день и осуществить оную.,Unknown
"Троцкого и Трусова сей час отвели на гауптвахту, где Тизенгаузен приказал им набить кандалы на руки и ноги.",Unknown
"— Говоря о наградах, — вскрикнули многие, — вы обижаете нас!",Unknown
"Души, возвышенные опасностью предприятия, были готовы принять священные и таинственные чувства религии, которые проникли даже в самые нечувствительные сердца.",Unknown
"Мозалевский воротился, проехал глухими переулками Васильков, поворотил вправо, на деревню Бугаевку, лежащую в стороне от большой дороги, и проселками доехал до деревни, находящейся близ Киева.",Unknown
"Мы сказали, в чем можно упрекнуть С. Муравьева; скажем теперь и то, что может служить к его оправданию.",Unknown
Не было никакого средства доказать свою невинность.,Unknown
"Отдавая другое письмо к подполковнику Крупенникову, Муравьев сказал:  — Объявить ему, что представляется удобный случай присоединиться ему с своим полком к нашему, скажите, что я надеюсь на его патриотизм и усердие к общему делу и ожидаю от него положительного ответа.",Unknown
"С. Муравьев тотчас согласился и приказал кучеру прямо туда ехать, но Соловьев всеми силами воспротивился сему, как бесполезному, так и ничтожному покушению, просил Муравьева оставить его намерение и, не ожидая его согласия, он крикнул грозно на кучера:  — Пошел, прямо!",Unknown
"Описав восстание Черниговского полка и горестный конец сего предприятия, мы почитаем необходимым сказать, какой жребий постиг всех участвовавших в оном.",Unknown
"— Но каким образом, — возразил Горбачевский,— мы можем прекратить сношения с теми, которые уже около двух лет считаются нашими сочленами, мне кажется, для сего нужно наше и их согласие.",Unknown
"Не менее сего вредно было явное желание Муравьева и Бестужева сосредоточить всю власть в своих руках: они хотели одни двигать членами, разбросанными в разных полках, и запрещали им иметь между собою сношения.",Unknown
"Из его слов видно было, что конституция, заключающая в себе формы республиканского правления для России и получившая одобрение многих знаменитых публицистов — английских, французских и германских, принята была единодушно членами Южного общества.",Unknown
"Здесь отдав унтер-офицеру Николаеву и одному из рядовых по равному числу списков Политического катехизиса, приказал им по приезде в город оставить лошадей в каком-нибудь скрытом месте, разойтись в разные стороны по Нодолу и Печерску, и там раздавать сии списки встречающимся людям, подбрасывать их в дома или оставлять в местах более посещаемых; когда же все списки таким образом будут сбыты с рук, то немедленно сойтись и ожидать его близ заставы на Подоле.",Unknown
Засим последовало примирение.,Unknown
"Взяв его за руку, Соловьев хотел его вести к офицерам, оставшимся еще на прежнем месте.",Unknown
"Мысль о силе Южного общества, надежда видеть при своей жизни освобождение отечества и других славянских народов увлекла совершенно славян; в общем пылу благородных страстей своих они согласились немедленно соединиться с Южным обществом, разделять с ним труды и опасности для блага своей родины, и от сей минуты цель, правила и меры, принятые сим Обществом, почитать своими собственными.",Unknown
"Артамон Муравьев взял записку и, казалось, тронутый просьбами своего родственника и сочлена, соглашался доставить оную славянам, но лишь только С. Муравьев уехал, он ее уничтожил, как и прежние.",Unknown
"Сегодня арестуют одного, завтра другого; надобно на что-нибудь решиться.",Unknown
"Потом он рассказал все, что слышал от Борисова 1-го о намерении членов, находящихся в 8-й бригаде и Житомире.",Unknown
— двинулась по дороге в деревню Мотовиловку.,Unknown
"В его глазах сии люди были способны ко всяким предприятиям, были храбры, отчаянны, тверды и настойчивы в своих намерениях и потому не чужды благородных чувствований; — разврат же их, происходил только от унижения и бедности.",Unknown
"Если бы план сего сочинения не заставлял нас заняться главнейшими происшествиями и избегать рассуждений, то мы могли бы подтвердить нашу мысль многими другими разговорами славян и тем доказать, что помянутое истребление никогда не было предметом общих рассуждений на совещаниях.",Unknown
"Голиков был в числе схваченных, Бочарову удалось бежать.",Unknown
"Преобладаемый, так сказать, единственною мыслию о восстании, о котором только и говорил, он вообразил, что существование самовластия в России приходит уже к концу.",Unknown
"Супружеская и родительская любовь мгновенно поколебали в нем первый порыв любви к отечеству, он готов был отказаться от прежних слов своих, но Муравьев снова успел возбудить в душе его благородное самоотвержение.",Unknown
Борисов 2-й и его товарищи были уверены в скором прибытии Пензенского полка и ахтырских гусаров и старались приготовить все нужное к походу.,Unknown
"Солдаты произносили обещание с отвращением; некоторые из них стояли с мрачным и неподвижным взором, в глубоком молчании, и не только не повторяли слов священника, но даже не слушали оных, а офицеры показывали явно нетернение и негодование, были совершенно невнимательны к сему обряду, и многие из них даже не поднимали руки, как это бывает при подобных случаях.",Unknown
"— Наше правительство, — говорил он часто,— не наказывает нас, но мстит нам; цель всех его гонений не есть наше исправление, не пример другим, но личное мщение робкой души.",Unknown
"Присоединим к сему действию благородное поведение офицеров, кроткое обращение с подчиненными, бескорыстную заботливость о их нуждах, тогда это вместе нам покажет, каким образом они умели найти верное и неизменное содействие людей, решившихся с ними погибнуть.",Unknown
"Это нечаянное свидание было величайшей радостью для всех: дело, за которое они погибли, уничтожило между ними различие чинов и сословий; общее несчастие сделало их искренними друзьями.",Unknown
"(Сухинов служил в Отечественную войну в Лубенском гусарском полку, получил в разных сражениях против французов семь ран; левая рука была сильно разрублена и в другой раз прострелена пулею).",Unknown
"Аполлон Веденяпин предложил съехаться на его квартиру, которая находилась в уединенном месте на берегу реки, на что и согласились.",Unknown
"Бедность, нищета и даже позор ожидают мою жену и моих сирот.",Unknown
Некоторые из них притворялись пьяными с намерением отстать от полка и предаться беспорядкам.,Unknown
Богуславля.,Unknown
"Андреевич расположился покойно за чайным столиком, с твердою решимостью дождаться возвращения Швейковского, полагая что он виделся с Муравьевым и Бестужевым, знает о приказе арестовать первого из них и может сказать ему, куда они оба поехали.",Unknown
"Бестужев обещал немедленно доставить им копию с конституции, объяснить цели, меры и управление оного Общества, и при окончательном соединении даже наименовать главных членов; но объявил, что правила Общества запрещают ему открыть местопребывание Верховной думы и членов, составляющих оную.",Unknown
Нельзя не упомянуть о сем происшествии.,Unknown
"Можно ли было полагать, что средством к разбитию Черниговского полка будет употреблена конная артиллерийская рота, в которой не только командир, но все без исключения офицеры принадлежали к Южному тайному обществу.",Unknown
"видя, что уговорить полковника значит понапрасну терять слова и время, после долгого молчания сказал:  — Вы видите, что я приехал к вам безо всего, в одной шинели; вы знаете, куда и зачем я еду; на каждом шагу я должен подвергаться опасности быть арестовану... Итак, дайте мне пару пистолетов или солдатское ружье: в моем положении необходимо иметь что-нибудь для обороны.",Unknown
"Распустив их по квартирам, С. Муравьев приказал им готовиться к походу.",Unknown
"Относительно гражданских чиновников он был вовсе противного мнения: в его глазах эти люди были не только бесполезны, но даже вредны; преобразование России должно было быть следствием чисто военной революции.",Unknown
"Ни один полковой командир 9-й дивизии, 8-й гусарской и командир артиллерийской роты, никто из них никогда из своего полка не принял ни одного офицера в Общество (хотя в полках сих дивизий находилось много членов Общества из субалтерн-офицеров, мо все они были приняты: или — славянами, или — Бестужевым-Рюминым).",Unknown
Подали чай.,Unknown
"Простодушный малороссиянин долго не хотел принять сих денег, но усиленные просьбы Сухинова победили, наконец, его бескорыстие.",Unknown
"Но время нам возвратиться к славянам, собравшимся для избрания посредника.",Unknown
"Хотя многие разделяли последнее сие мнение, но никто, кроме Иванова, не поддерживал оное; умы всех были обворожены близким и как бы несомненным преобразованием России, и, по-видимому, каждый предоставлял обстоятельствам решить вопрос соединения.",Unknown
"Тут же в душе его возродилась мысль кончить добровольно бесполезные страдания, избегнуть позора и наказания.",Unknown
