text,author
"Командир Ахтырского полка под разными предлогами задержал Гебеля несколько часов и через то дал возможность С. Муравьеву и его товарищам доехать до деревни Трилесы (одна услуга, оказанная им тайному обществу и С. Муравьеву).",Unknown
"Его слова видимо ободрили солдат, слушавших его со вниманием, прежнее спокойствие опять заблистало на всех лицах, и никто не думал воспользоваться позволением удалиться.",Unknown
При первых выстрелах он спрятался в обозе.,Unknown
Андреевич не делал никаких возражений: предложение черниговских офицеров ему понравилось; он тотчас согласился исполнить его со всевозможною ревностию.,Unknown
"Замечательно, что в это время гусарский офицер высокого роста и довольно плотный, подъехав на близкое расстояние к одному из постов, начал разговаривать с солдатами, хвалил их решительность, одобрял восстание, удивлялся пожертвованиям и обещал помощь.",Unknown
"Около 11 часов ночи, с 28 на 29 декабря 1825 года, Кузьмин получил через рядового вверенной ему роты записку следующего содержания:  «Анастасий Дмитриевич!",Unknown
"В 1824 году был принят в Славянское общество юнкер Драгоманов, молодой человек, получивший хорошее воспитание.",Unknown
"Узнав о времени своего отправления незадолго до выступления полка и не имея возможности отлучиться в продолжение молебна и чтения катехизиса, он двинулся вместе с полком и тогда только забежал на свою квартиру, когда полк проходил мимо ее.",Unknown
Преданность к ротным командирам и любовь к С. Муравьеву одни не могли сего произвести.,Unknown
"Не взирая на то, ‘что Мозалевский отрицал все сделанные на него показания, он был отправлен в главную квартиру /-й армии в 3 часа утра с жандармским офицером Скоковым.",Unknown
Из Радомысля Андреевич спешил в Житомир: там он надеялся увидеться со славянами и решиться на какие-нибудь меры.,Unknown
"Сверх того, так как члены Южного общества были, большею частью, люди зрелого возраста, занимавшие довольно значащие места и имевшие некоторый вес по гражданским отношениям, то для них было тягостно самое равенство их свободного соединения; привычка повелевать невольно брала верх и мешала повиноваться равному себе, и тем более препятствовала иметь доверенность в сношениях по Обществу с лицами, стоящими ниже их в гражданской иерархии.",Unknown
"Сей слабый очерк достаточно показывает, что дух Славянского общества во многом отличался от духа Южного общества, и что даже в некоторых отношениях они были друг другу совершенно противоположны.",Unknown
"15 сентября С. Муравьев попросил к себе Спиридова, Горбачевского и Пестова, которые приехали к нему в назначенный час.",Unknown
"Однако, несмотря на сие, имея всегда в виду только достижение цели, они согласились и молчали обо всем, единственно для того еще, чтобы не повредить успеху дела.",Unknown
Он видел одного Тизенгаузена и всю надежду полагал на него.,Unknown
Можно ли о сем говорить с ними?,Unknown
"— Я думаю совершенно противное, — возразил с притворным хладнокровием Андреевич, — товарищи мои надеются на вас, и их надежды основываются на ваших собственных словах; вы не раз говорили о преданности и любви к вам своих подчиненных, о готовности офицеров и солдата следовать за вами повсюду; итак вам легко возбудить их к мятежу.",Unknown
— чтобы полк двинулся и действовал в смысле его.,Unknown
"Они часто разговаривали с ним о своем положении, и когда Сухинов начинал говорить о возможности освобождения, они старались доказать ему нелепость такого предприятия.",Unknown
"Муравьев не только не принимал в члены офицеров Черниговского полка, но даже не знал, что с ним служат офицеры, которые уже два года принадлежат к другому тайному обществу.",Unknown
"Вскоре после отъезда С. Муравьева из Любара приехал к Артамону Муравьеву подполковник Гебель с жандармским поручиком Лангом, которого он взял с собою из Житомира вместо двух жандармских офицеров Несмеянова и Скокова, бывших у него в Василькове.",Unknown
"На вопрос Мозалевского: когда он должен ехать и где, по исполнении поручения, догнать полк?",Unknown
"Будучи столь же пылок и решителен, как Ипполит Муравьев, Кузьмин присовокуплял к сему постоянство в стремлении к цели: ни время, ни препятствия не могли отвратить его от предпринятого им однажды намерения.",Unknown
внезапно утешения в своих бедствиях.,Unknown
Успех был неимоверный: солдаты изъявили готовность во всем повиноваться своим офицерам.,Unknown
"Они могут принимать также в Общество офицеров, если найдут таких, которые заслуживают сию честь.",Unknown
"— Знаю, и затем именно туда иду, — отвечал смело Шутов.",Unknown
"В исполнение сего намерения они положили определить некоторую часть общественной суммы на выкуп крепостных людей; стараться заводить или споспешествовать заведению небольших сельских и деревенских училищ; внушать крестьянам и солдатам необходимость познания правды и любовь к исполнению обязанностей гражданина, и таким образом возбудить в них желание ........ и изменить унизительное состояние рабства и пр.",Unknown
"Догадка сия подтверждается тем, что даже большая часть членов Южного общества не знала причины собрания.",Unknown
"Раздор членов, обманчивые надежды на помощь людей, с коими они не имели никаких сношений, преувеличение сил своих, слабость характеров, боязнь междоусобия, желание достигнуть своей цели без трудов и опасностей, — заранее уничтожили всякую уверенность в успехе.",Unknown
"Для лучшего успеха он с ним поехал к Соловьеву, но, не застав его дома, он должен был отложить сии переговоры до другого дня.",Unknown
"И, наконец, он прибавил, что дорогою узнал о печальном событии 14 декабря.",Unknown
"В скором времени майор Трухин, вероятно из предосторожности, разлучил Соловьева и Щепиллу, приказав перевести сего последнего на квартиру и содержать там под таким же строгим присмотром, как и на гауптвахте.",Unknown
"Партия, с которой они шли, имела дневку в Чите.",Unknown
"Муравьев отвечал хладнокровно, что все, касающееся до Черниговского полка, принадлежит ему исключительно, и он не позволит никому другому вмешиваться в его распоряжения.",Unknown
"Зная, что Соловьев и Мозалевский не согласятся участвовать в каком-нибудь предприятии, Сухинов таил от них свои намерения, но не скрывал своей злобы против правительства.",Unknown
Мы желали показать общее усилие славян восстать против правительства и тем самым дополнить картину описываемого нами события.,Unknown
"Невозможно изобразить сей торжественной, трогательной и вместе странной сцены.",Unknown
Борисов прежде сего не был знаком с офицерами Пензенского полка.,Unknown
"Артамон засыпал его словами, но не дал верховой лошади, оправдываясь тем, что такой поступок покажется подозрительным местному начальству.",Unknown
"При сем известии С. Муравьев не мог скрыть своего замешательства, но успокоив верных ему офицеров, пошел с ними к собравшимся ротам.",Unknown
"Вручая ему письмо на имя одного генерала (которого фамилия неизвестна), Муравьев просил Мозалевского пересказать ему о всем случившемся в Черниговском полку, узнать от него, что думают другие члены о происшествии 14 декабря и о восстании Черниговского полка, и расспросить его о мерах, какие они со своей стороны думают принять; объявить ему о надеждах С. Муравьева на Киев, где находится так много членов русского и польского Обществ, и, наконец, просить на все письменного или словесного ответа.",Unknown
"Принятые в общество члены — поручики Шультен, Тихонов (9-й артиллерийской бригады) и старший адъютант 9-й дивизии Шахирев приехали с Пестовым.",Unknown
"Сделав несколько шагов назад, солдат прицелился в Соловьева, гроза застрелить его, если он не откроет С. Муравьева.",Unknown
"В Житомире при свидании с Ивановым и Киреевым он узнал о повелении арестовать С. Муравьева, о погоне за ним подполковника Гебеля, Бестужева, и проезде Андреевича через Житомир, который тоже поскакал ‚догонять С. Муравьева.",Unknown
"Прежде, нежели расскажем встречу его с отрядами Гейсмара, необходимо показать (сколько нам известно), в каких силах он сошелся с неприятелем.",Unknown
"Посему гражданское общество, как целое, составленное из единиц, необходимо зиждется на тех же началах и для достижения возможного благосостояния требует промышленности, отвращающей бедность и нищету; нравственности — исправляющей дурные наклонности, смягчающей страсти и внушающей человеколюбие; и, наконец,— просвещения, вернейшего сподвижника в борьбе противу зол, неразлучных с существованием, которое делает умнее и искуснее во всех предприятиях.",Unknown
"Иногда ему случалось ночевать вместе с отыскивавшими его чиновниками; и несколько раз спрашивали его, не случалось ли ему встретить где-нибудь человека с такими-то приметами, прозываемого Сухинов?",Unknown
"Утверждают, будто границы Галиции занял 30-ти тысячный корпус австрийцев.",Unknown
"Бестужев-Рюмин с жаром отвергал сии доводы, говорил о неограниченной свободе, о благородстве цели, о высокости намерений.",Unknown
Вскоре их разлучили; Шутов и его товарищи были отправлены в Сибирь.,Unknown
"Бестужев начал объяснять чертежом управление Южного общества; говорил о различных управах, существующих в разных местах России, об образе их сношения с Верховною думою, о силе своего Общества, наименовал членов оного: кн.",Unknown
В начале января 1826 года в Бобруйске Полтавский полк вступил в свою очередь в караул.,Unknown
"Андреевич спросил бумаги и написал к Швейковскому записку, прося его поспешить домой.",Unknown
"Если русский солдат узнает сие повеление божие, то, не колеблясь ни мало, согласится поднять оружие против своего государя.",Unknown
"Мы смело утверждаем, чему все свидетели, бывшие в Лещине, что полковые командиры всегда говорили, — в том числе и С. Муравьев,— что они без всякого предварительного приготовления увлекут за собою солдат и офицеров.",Unknown
"Я не обязывался сломать себе шею для каждого: пускай приедет сам Муравьев, или пускай покажут мне приглашение к восстанию, написанное его рукою,— я тотчас взбунтую свою роту; до сего же времени ограничусь приготовлением солдат.",Unknown
"Различие между твоим и моим сделалось им неизвестно; вещи и деньги — все было общее, но каждый из них сообщал своим товарищам, куда он истратил деньги и кому отдал какую вещь.",Unknown
Вдруг растворилась дверь в залу п вошли два жандармских офицера: поручик Несмеянов и прапорщик Скоков.,Unknown
Поручик Щепилло умер в рядах; С. Муравьев был ранен в голову; Ипполит Муравьев в левую руку; Кузьмин — в плечо навылет; все трое картечами.,Unknown
"Около 60 человек и 12 крестьян, находившихся в обозе, были убиты или тяжело ранены.",Unknown
"Путь его к Кишиневу был весьма труден и опасен, очень часто он думал, что его узнают; часто он читал объявления правительства о бежавшем мятежнике Сухинове.",Unknown
"Во все время похода он был задумчив и мрачен, действовал без обдуманного плана и, как-будто, предавая себя и своих подчиненных на произвол судьбы.",Unknown
"Выходя от Муравьева, Бестужев-Рюмин остановил Борисова 2-го и Бечасного, спросил их, выбрали ли они посредника и, не дождавшись ответа, прибавил в рассеянности:  — Сделайте милость, не выбирайте Борисова 2-го.",Unknown
Между тем время летело и от Швейковского не было ответа.,Unknown
"Описывая его подробно, со всею справедливостью и истиною, мы хотим показать, каким образом действовали С. Муравьев и Бестужев, чего они хотели и должно ли было им так поступать с людьми, которые не скрывали от них ничего и которые, один раз решившись на все, не подвергая обсуждению предложения Бестужева, хладнокровно и без всякого противоречия назначали себя в убийцы из одного убеждения, что сего требует цель Общества и успех предприятия.",Unknown
Мозалевский с болышим затруднением мог нанять лошадей.,Unknown
"26 декабря, поутру, известие, полученное о происшествии 14 декабря, заставило славян собраться для совещания; они убедились в скором восстании, думая, что члены Южного общества пожелают завершить начатое в столице, На сем совещании положили: держать своих подчиненных в строгой дисциплине, стараться предупреждать беспорядки, обходиться с жителями как можно лучше, тотчас по восстании образовать в городе временное правление и выдать прокламации об освобождении крепостных людей; между тем, в ожидании положительного известия от Муравьева, приготовлять солдат и офицеров, на которых совершенно можно было положиться.",Unknown
"Не удивительно, что его товарищи не приняли в этом никакого участия.",Unknown
В Поволочи квартировала 5-я конная рота.,Unknown
"Прискорбно, что имя и фамилия сего великодушного человека останутся неизвестными, но он щедро награжден своею совестью.",Unknown
Но сим обстоятельствам Борисов.,Unknown
"Не нужно говорить, что от Тютчева требовали скромности и осторожности; ему никто не препоручал принимать в члены С. Муравьева; просили только с ним сблизиться и узнать все что можно о тайном обществе.",Unknown
"Посему, для надлежащего действия в сей роте нужна значительная часть пехоты и кавалерии, без коей фейерверкеры и рядовые, вооруженные только тесаками, несмотря на их готовность и рвение к делу, не могут одни обещать успеха, тем более, что артиллерийские лошади стоят в 45 верстах от парка.",Unknown
"Черниговского полка офицеры прямо действовали на солдат, но о сем никогда не знал С. Муравьев; никогда сии офицеры не говорили ему о сем, ибо знали наперед, что он будет сему противиться.",Unknown
"При переводе в гусарский полк Сухинов наказал киевскому портному полную офицерскую обмундировку, но не успел взять сшитого платья до несчастного восстания Черниговского полка.",Unknown
Деятельность и бдительность сего последнего оправдали вполне доверенность Муравьева и его товарищей.,Unknown
"Решившись на что-либо однажды для исполнения предпринятого им дела, он не видел уже никаких препятствий, его деятельности не было границ; он шел прямо к цели, не думая ни о чем более, кроме того, чтобы скорее достигнуть оной.",Unknown
Тело сего жалкого негодяя было разрублено ими на части и закопано в разных местах.,Unknown
"Поляк, узнав Сухинова по голосу, вышел к нему навстречу, повел в комнату и, расспрося о всем случившемся, благословлял небо за спасение его приятеля.",Unknown
"Сухинов, поблагодарив своего товарища за денежное вспоможение, сказал:  — Относительно моей скромности, я вас уверяю, что никогда не вспомню ни о Каменке, ни о ее владельце.",Unknown
По поручению Муравьева Мозалевский должен был вручить письмо трем членам тайного общества и распустить в народе несколько списков Политического катехизиса.,Unknown
"Фельдфебели, со своей стороны, были откровенны с солдатами, и сии последние, невольным образом, сколько могли, привыкли разделять их желания и цель.",Unknown
